chunk_id,doc_id,doc_type,chunk_idx,text,word_count,role
C342_c5,C342,case,5,"But, it is proved and established on record that the entire incident as it happened was mentioned in the First Information Report wherein the name of the eye-witnesses were also mentioned. The informant examined himself as PW-1. He narrated the entire incident as it happened on the day of occurrence and he was cross-examined at length, but his evidence could not be shaken. He had also explained the circumstances for which he was not been assaulted by the accused persons. He also stated in his deposition that he had not taken any such step to catch hold any of such accused persons on account of fear and also because he did not have any weapon in his hands. Further, he has categorically stated that he raised alarm to save his father from the assault by accused persons. The said evidence of PW-1 appear to us to be cogent and natural. The same also gets corroborated by the evidence of other two eye witnesses namely PW-3 and PW-6 and also by the medical evidence namely the Injury Report and the Post mortem Report. 25. The High Court was also not right in holding that the aforesaid two eye witnesses could not be accepted as eye witnesses to the occurrence. The High Court held that all the said three witnesses as chance witnesses. The said findings are based on surmises and conjectures. The date of the incident was a market day at Gauriganj and therefore it was natural that persons from the nearby areas would go to the market place. Therefore, PW-1 accompanying his father on the date of the incident to the market and PW-3 and PW-6 being present at the place of occurrence cannot be said to be unnatural. 26. So far as the dying declaration of the deceased is concerned, the same apparently was not recorded either by the Police Officer or by the doctor. There is some doubt about making of such dying declaration by the deceased and therefore, the dying declaration said to have been made by the victim was not correctly relied on by the High Court. But even if the said dying declaration is taken out of purview of the evidence on record, even then the statements of the eye-witnesses can under no circumstances be doubted and held as untrustworthy. 27. We find no reason as to why close relatives of the deceased would try to rope in someone else as the murderers of their near relation and give up the actual accused. It is against the human conduct. In a case of murder the near relations would make all endeavour to see that actual culprits are punished . 28. In the light of the aforesaid discussion, we allow this appeal, set aside the order of acquittal passed by the High Court and restore the order passed by the trial court. The bail bonds of the accused persons are cancelled. They shall surrender to serve out the remaining part of their sentence. So far as respondent No. 5 (Hansraj) is concerned, the order of the Trial Court",512,RLC
C357_c2,C357,case,2,"Court has not held that the view taken by the trial court was not a possible view. The High Court reappraised the evidence and took a different view and it explained the infirmities of the prosecution pointed out by the Sessions Judge. In G. B. Patel & Anr. v. State of Maharashtra, [1979] 2 SCR 94 1978 Indlaw SC 95 this Court quoted with approval the principles laid down by Privy Council in Sheo Swarup v. King Emperor, AIR 1934 PC 227 1934 Indlaw PC 30 wherein it was held that although the power of the High Court to reassess the evidence and reach its own conclusion, are as extensive as in an appeal against the order of conviction, yet, as a rule of prudence, the High Court should always give proper weight and consideration to matters e.g. (i) the views of the trial judge as to the credibility of the witnesses; (ii) the presumption of innocence in favour of the accused, a presumption certainly not weakened by the fact that he has been acquitted at the trial; (iii) the right of the accused to the benefit of any doubt, and (iv) the slowness of an appellate court in disturbing a finding of fact arrived at by a Judge who had the advantage of seeing the witnesses. 2. Sarkaria, J. speaking for the court observed ""where two reasonable conclusions can be drawn on the evidence on record, the High Court should, as a matter of judicial caution, refrain from interfering with the order of acquittal recorded by the court below. In other words, if the main grounds on which the court below based its order acquitting the accused, are reasonable and plausible, and cannot be entirely and effectively dislodged or demolished, the High Court should not disturb the acquittal."" While considering an appeal against acquittal the High Court must keep in mind these principles in appreciating the evidence of witnesses. If on appraisal of the evidence and on considering relevant attending circumstances it is found that two views are possible, one as held by the trial court for acquitting the accused, and the other for convicting the accused in such a situation the rule of prudence should guide the High Court not to disturb the order of acquittal made by the trial court. Unless the conclusions of the trial court drawn on the evidence on record are found to be unreasonable, perverse or unsustainable, the High Court should not interfere with the order of acquittal. The High Court has in the instant case made an attempt to explain away the infirmities in the testimony of eye-witnesses in setting aside the order of acquittal. The High Court has in our opinion disregarded the rule of judicial prudence in converting the order of acquittal to conviction. The trial court held that the cumulative effect of the following circumstances made the prosecution case doubtful, these are; (i) first information report was not recorded or lodged at the time it purports to have been lodged, (ii) Rajendra Singh PW 14 and Chhotey Bhaiya PW 15, the",512,RLC
C357_c3,C357,case,3,"to conviction. The trial court held that the cumulative effect of the following circumstances made the prosecution case doubtful, these are; (i) first information report was not recorded or lodged at the time it purports to have been lodged, (ii) Rajendra Singh PW 14 and Chhotey Bhaiya PW 15, the two eye-witnesses did not give the names of assailants to Tohid, (iii) recovery of two cartridges on 5th January. 1982 one day after the occurrence, (iv) nature and position of injuries on the body of the deceased were not consistent with the testimony of eye-witnesses having regard to the local site (v) empty cartridges of .315 rifle which were alleged to have been fixed by Brijesh and 12 bore cartridge was alleged to have been fired by Awadesh accused causing injuries to the deceased, but the same were not sent to ballistic expert for his opinion nor he was examined to support the prosecution case, (vi) unnatural and inconsistent testimony of eye-witnesses Rajendra Singh PW 14 and Chhotey Bhaiya PW 15, (vii) a large number of persons were available at the scene of occurrence at the octroi Toll barrier but no independent witness, either employee of the Toll barrier or of Home Guard or any other person was examined to support the prosecution. The High Court made an attempt to explain the circumstances in holding that some times the memory of the witnesses fail and a broad view of the evidence given by the eye-witnesses clearly indicated that the prosecution had proved its case. We have been taken through the entire evidence and we have also closely and carefully considered the judgment of the trial court and the High Court. We are of opinion that the High Court committed error in interfering with the order of acquittal. The first information report Ex. P. 12 shows that the occurrence took place on 14.15 hours while the report was lodged at 15.10 hours that is to say within 55 minutes of the occurrence. The evidence on record and the attending circumstances indicate that the first information report was not lodged at 15.10 hours instead it was lodged at about 17.00 hours. Rajendra Singh, PW 14 stated before the trial court that from the place of occurrence he had accompanied the police to Panna Kotwali where he lodged the report and signed the Ex. P. 12. In cross-examination he stated that he had gone to the Kotwali for lodging report in a police van. He further stated that the report had been written by the Police clerk on his dictation, and that the police arrived at the scene of occurrence after an hour of his lodging the first information report. At an earlier stage he had stated that the police had arrived at the place of occurrence at about 3.30 p.m. and thereafter he had accompanied the police to Kotwali for lodging the report. His testimony regarding lodging of the first information report is contradictory. V.P. Pathak, PW 20 Sub-Inspector of police, the investigating officer, stated that it was wrong to say that the first",512,RLC
C375_c0,C375,case,0,"Union of India and Others v Messrs Indo-Afghan Agencies Limited Supreme Court of India 22 November 1967 Civil Appeals Nos. 885893 of 1967 The Judgment was delivered by : J. C. Shah, J. 1. The facts which give rise to Appeal No. 885 of are these: The Textile Commissioner published on October 10, 1962, a scheme called the Export Promotion Scheme providing incentives to exporters of woollen goods. The scheme was extended by a Trade Notice dated January 1, 1963, to exports of wooden goods to Afghanistan. Messrs. Indo-Afghan Agencies-hereinafter called the respondents a firm dealing in woollen goods at Amritsar exported to Afghanistan in September, 1963, woollen goods of the f.o.b. value of Rs. 5,03,471-73 nP. The Deputy Director in the office of the Textile Commissioner, Bombay issued to the respondents an Import Entitlement Certificate for Rs. 1,99,459 only/-. Representations made by the respondents to the Deputy Director and to the Union Government that they be granted Import Entitlement Certificate for the full f.o.b value of the goods exported failed to produce any response. 2. But in a petition under Art. 226 of the Constitution moved before the High Court of Punjab by the respondents for a writ or an order directing the Union of India, the Textile Commissioner and the Joint Chief Controller of Imports and Exports, Bombay, to issue a licence ""permitting import of wool-tops, raw wool, waste and rags of the value of Rs. 3,04,012-73 nP"", the orders of the Textile Commissioner and the Central Government were set aside. The High Court held that the Export Promotion Scheme specifically provided for granting certificates to import materials of the ""value equal to 100% of the f.o.b. value of the goods exported"", and the respondents were entitled to obtain import licences for an amount equal to 100% of the f.o.b. value, unless it was found on enquiry duly made under cl. 10 of the Scheme that the respondents had by ""over invoicing"" the goods disentitled themselves to the import licenses of the full value; that no such enquiry was made by the Textile Commissioner and that officer merely proceeded upon his ""subjective satisfaction"" that the respondents had 'over-invoiced"" the goods exported; and that the Union Government acted on irrelevant grounds. The Union of India, the Textile Commissioner and the Joint Chief Controller of Imports and Exports have appealed to this Court with certificate granted by the High Court. 3. The genesis of the export control scheme may first be noticed. The Imports and Exports (Control) Act 18 of 1947 was enacted on March 24, 1947 with the object of enabling the Central Government to continue to exercise the power to prohibit, restrict or otherwise control imports and exports which had till then been controlled by orders issued in exercise of the powers conferred by r. 84 of the Defence of India Rules, 1939, as extended by the Emergency Provisions (Continuance) Ordinance 20 of 1946. By s. 3 of that Act it was provided: ""(1) The Central Government may by order published in the Official Gazette, make provisions for prohibiting, restricting",512,RLC
C384_c11,C384,case,11,"the estate and the other half belonged to plaintiffs 9 to 15. 33. On the above basis, Title Suit No. 5 of 1961 was filed by the plaintiffs therein for a declaration of their title. The plaintiffs in Title Suit No. 44 of 1955 were impleaded as defendants in Title Suit No. 25 of 1958 and Title Suit No. 5 of 1961. The plaintiffs in Title Suit No. 25 of 1958 were impleaded as defendants in the other suits. Similarly the plaintiffs in Title Suit. No. 5 of 1961 were impleaded as defendants in the two other suits. The State of Bihar which had preferred its claim on the basis of the rule of escheat was also impleaded as defendant in each of the three suits. The defendants in each of the suits other than the State of Bihar denied the claim of the plaintiffs in that suit. 34. The State of Bihar pleaded in all the three suits that none of the plaintiffs was an heir of the last male holder. The Additional Subordinate Judge, Patna who tried all the three suits together dismissed all of them by his judgment dated February 15, 1966. The principal issues which arose for decision before the trial court were: (1) Was Raja Jugal Kishore Singh the Putrika-Putra of Raja Dhrub Singh by appointed daughter and affiliated as such as alleged by the plaintiffs in Title Suit No. 44 of 1955 and Title Suit No. 25 of 1958? (2) Was succession to Bettiah Estate governed by the Mithila or the Benares School of Hindu Law? (3) Was the Bettiah Estate self-acquired or the joint property of Raja Jugal Kishore Singh? (4) Was the succession to the Bettiah estate governed by the rule of primogeniture? (5) Whether any of the plaintiffs was the heir of the last male holder; and (6) Has the Bettiah estate vested in the State of Bihar by escheat? 35. At the conclusion of the trial, the trial court held that the custom of taking a son as Putrika-Putra had become obsolete by the time Raja Dhrub Singh was alleged to have taken Raja Jugal Kishore Singh as the Putrika-Putra and, therefore, Raja Jugal Kishore Singh was not the Putrika- putra of Raja Dhrub Singh; that the succession to the estate of Maharaja Harendra Kishore Singh was governed by the Benares School of Hindu law; that the estate having been acquired by force of arms was the self-acquired property of Raja Jugal Kishore Singh; that the succession of the Bettiah estate was not governed by the rule of primogeniture; that in view of the finding that Raja Jugal Kishore Singh was neither putrika-putra nor was he affiliated to of family of Raja Dhrub Singh by adoption in any form, the plaintiffs in Title Suit No. 25 of 1958 and Title Suit No. 44 of 1955 could not claim to be the heirs of the last male holder: that the plaintiffs in Title Suit No. 5 of 1961 had not established that they were the reversioners to the estate and as none of",512,RLC
C386_c2,C386,case,2,"of equal pay for equal work has nothing to do with Art. 14. Art. 14, therefore, cannot be said to be violated whose the pay scales of Class I and Class II Income-tax Officers are different though they do the same kind of work. Incremental scales of pay can be validly fixed dependent on the duration of an officers service."" 8. The High Court also referred to the decisions of this Court in State of Punjab v. Joginder Singh, Unikat Saakunni Menon v. State of Rajasthan and State of Mysore & Anr. v. P. Narsingh Rao in which cases also certain grouping of employees were challenged as violative of Art. 14 & 16, which challenge was repelled by the Supreme Court. The High Court relied upon these decisions and held that ""It is therefore evident that it was open to the Government to fix two different pay-scales for Senior Draughtsmen,"" and that ""It was for the Government to decide what pay-scale should be provided to the different. classes of employees and simply because they have been provided different pay- scales that would not amount to discriminations."" 9. The High Court was told that all the Senior Draughtsmen did the same kind of work and discharged same or similar duties and that therefore there was no justification for a distinction being made between the two classes of Senior Draughtsmen, providing two different pay-scales on the basis of seniority, Denial of the higher scale of pay to one class of Senior Draughtsmen, only on the ground of length of service was, according to the appellants, wrong. The Government brought in this classification, by its Order dated 1-7-1978, directing that only Senior Draughtsmen, holding that post on 31-12-1972, would be given the Senior scale and not those who did not hold that post on 31-12-1972. This basis, the appellants, contended was unsupportable. These contentions did not appeal to the High Court. While repelling the arguments of the Petitioners, the High Court observed that ""The petitioners are unable to show a single authority in support of their contention that all the persons doing the same work are entitled to same scale of pay."" It is the correctness of this decision that falls to be decided in this appeal. 10. Before discussing the factual matrix of the case, we will refer to the Order passed by the Government of India on 27th January, 1978, which brought into effect this difference in the pay-scale. The said Order reads as follows: ""The undersigned is directed to refer to Sl. No. 32 of Part-D, Section I, in the First Schedule to the Civilians in Defence Services (Revised Pay) Rules, 1973 and to say that the President is pleased to decide that, as recommended by the Third Pay Commission in para 81, Chapter 14, of their report, half the number of posts of Draughtsman in the DGOF Organisation on the present pay scale of Rs. 205-7-240-8-280 will be placed in the revised scale of Rs. 425-15-500-EB-15-560-20-700 and the remaining half in the revised scale of Rs. 330- 10-380-EB-12-500-EB-15-560....................... ....On their allocation",512,RLC
C397_c1,C397,case,1,"Code of Criminal Procedure, the material portions of which extracted below: ""I was doing patrolling duty with the service rifle, and at about 7.45 P.M. when it was absolute dark I came near the bridge for proceeding towards the value tower. Then I saw a flame near the tower and saw somebody moving. I suspected that some miscreant was about to commit mischief with fire on the valve tower. As I could not identify the moving person due to want of light I shouted at him to stop. But there was no reply. So I proceeded further and repeated the shout, and still there was no reply. I had to open fire in discharge of may duties. I heard the sound of something falling down. I then reported the incident to the persons who were in the office. When constable Laxmansinh (PW-2) and Jayantrajsinh (PW-3) arrived after seeing the body of the victim they informed me that it was Ukadbhai Radvabhai who received bullet injuries."" Trial court felt that the defence version is quite probable and hence he is entitled to the benefit of doubt. High Court found that the trial court went perversely wrong in entertaining such a doubt on the facts of the case. High Court took particular not of certain circumstances which showed that appellant was nut ring grouse against the deceased. Ext. B-15 report prepared by the deceased containing a complaint that appellant committed acts of dereliction of duties and that when appellant was warned about it he burled invectives against the deceased and left the work place in a huff. Deceased expressed his apprehension, in Ext. B-15, that appellant might do something in revenge and so he made a request to his platoon commander to shift the appellant to some other section. PW-3 Jayantrajsinh - a colleague of both deceased and appellant - narrated the incident which ensued exchange of words between appellant and deceased. The witness also said that when he knew about Ext. P-15 report he snatched it from the deceased and prevailed upon him to desist from forwarding it to the superiors, but later when he heard that the appellant was fuming with acerbity towards the deceased he returned Ext. P-15 to him. One most important circumstance is, Ext. P-15 report was collected by the police from the bag of the deceased after his death. There is no dispute regarding the authorship of that report. The evidence in this case, in the light of the admissions made by the appellant, has narrowed down to the following points: Appellant had fired his rifle and the deceased who was on his duty, sustained the bullet injuries and died. As the High Court observed, it would have been a close range firing. This could be inferred from the blackening of the skin around two entry wounds. Learned counsel for the appellant first contended that since appellant was discharging his official duties he is entitled to acquittal. No person can claim immunity from culpable homicide merely on the ground that the killed another person in discharge of his",512,RLC
C403_c4,C403,case,4,"demands and the quantum differed from time to time. On some occasion he had demanded Rs.10,000/- and on other occasions Rs.15,000/- or Rs.1,00,000/-. It appears to us wholly unreasonable to reject the evidence of such witnesses merely on the ground that there is no consistency as to the exact amount demanded by the respondent. 11. There is yet another reason given by the High Court for rejecting this part of the prosecution's case. The High Court observed that no neighbour from Gundlepet was examined to prove the fact that the deceased was being ill treated by her husband. The High Court completely lost sight of the fact that the matrimonial home of the deceased was at Gundlepet and therefore, it was not possible for the prosecution to get witnesses from Gundlepet who would have supported the case of the prosecution. Moreover, the deceased had gone to Gundlepet as a newly married daughter-in- law and it was not expected, even if she was ill treated, to go about in the neighbourhood complaining against her husband. In any event this is not a good enough reason to reject the testimony of such a large number of witnesses who have deposed on this aspect of the case. 12. Another reason given by the High Court is that in Exhibit D- 3 a letter written by the deceased to her husband quite sometime back, there is no mention of any ill treatment meted out to her by the respondent, and that no other letter has been produced to show that she had even mentioned in any such letter that she was being ill treated. This approach of the High Court is again highly unreasonable. Merely because in one of the letters written to her husband she had not complained about ill treatment, is no ground to hold that she was never ill treated. We have read that letter from which it appears that it was one of those letters written by her in which there is no reference to bitterness in their marital life. However, it is not expected that in every letter that a wife writes to her husband, she must complain to him about his ill treatment. Merely because in one solitary letter there is no reference to ill treatment by the respondent, would be no ground to arrive at the conclusion that she was never ill treated by her husband, particularly in the face of evidence of a large number of witnesses. We, therefore, find no justification for the finding of the High Court that the deceased was not ill treated by the respondent, or that there was no motive to commit the offence. 13. As far as medical evidence is concerned, the High Court rejected the evidence of the doctor (PW6) who had conducted the post mortem examination of the dead bodies of the deceased and her child. The reasoning of the the High Court appears to us to be rather strange. The High Court noticed the fact that in the post mortem report the cause of death was mentioned to be",512,RLC
