chunk_id,doc_id,doc_type,chunk_idx,text,word_count,role
C2213_c10,C2213,case,10,"prima facie it would be discriminatory and when the legality of the order is challenged, its intra vires character could be sustained only by disclosing the reasons which led to the passing of the order. 28. In the present case, when the matter was before the appellate Court the Advocate-General filed a memorandum setting out the reasons why exemption was granted in the three cases before the Court. In regard to the exemption which was the subject of controversy in writ appeal 28 of 1953 with which we are concerned, the memorandum which the Government filed ran: ""The Government exempted the building................. for the following reasons:- When the High Court offered in 1940 to lease out the premises in question for a period of 21 years, Sri Chettiar elected to take it on lease only for a period of seven years, which expired in 1947. As per the High Court's order in C. S. Nos. 280 to 286 of 1939, Sri J. H. Irani, father of Sri P. J. Irani took a lease of the promises for a period of 13 years 11-1/2 months from 1947 and he deposited Rs. 10,000 towards the said lease. He is therefore entitled for the benefits from 1948 onwards. Had not the Rent Control Act come into force, Sri P. J. Irani would have got possession in the ordinary course as per High Court's order and the terms of the lease deed. The operation of the Act is therefore really a hardship to him. Sri Chettiar is only an absentee lessee and he is having several other business in South India. The conduct of Sri Chidambaram Chettiar in refusing to surrender the possession of the building to Sri P. J. Irani who had taken a valid lease under the orders of the High Court is that of a hard litigant seeking to exploit the letter of the law without much regard to bona fides; and Sri Chettiar had already managed to be in possession of the building for five more years than he was legitimately entitled to be."" 29. The learned Judges of the High Court held that the reasons which led the Government to grant the exemption were not those which were countenanced by the policy or purpose of the Act and that the order of exemption was, therefore, invalid. In doing so the learned Judges said: ""Reasons 1, 2 and 4 go together and have refe- rence to the order of the High Court in 1940 directing the Receivers to execute a lease for seven years to the appellant and after the expiry of that period to grant a lease for fourteen years to the second respondents father. It is undoubtedly true that but for the application of the Act, the second res- pondent's father would have obtained possession of the premises after the expiry of lease in favour of the appellant. That could be said of thousands of cases in which the leases in favour of tenants have expired and, but for the Act the owners would be entitled to obtain possession of",512,RLC
C2229_c11,C2229,case,11,"such defence. In this view of the matter, we see no infirmity in the judgment of the trial Court or in the judgment of the High Court in Convicting the Appellants in Criminal Appeal No, 872 of 1997 35. As set out hereinabove, accused Sardar had been acquitted by the High Court only on the ground that he should be given the. same benefit of doubt which had been given to accused Usman and Ramzu. The High Court also accepts the fact that the door was broken open and 3 persons of the complainant party were injured in the house. The High Court also notes that circumstances indicate presence of ""more persons"". The High Court also notes that as door was broken open there was possibility of presence of axe in the hands of some persons. Yet the High Court acquits Sardar only on ground that acquittal of two accused had become final. It is to be noted that Sessions Court gave benefit of doubt to Usman and Ramzu on the basis of contradiction in deposition of witnesses, I smile, Yusuf and Mubarik with regard to the assault to the witnesses and also as there was no mark of injuries on their person. But this would not mean that there was any reason to discard the consistent evidence of prosecution witnesses with regard to the assault made by Sardar, The High Court also observed that according to Yaqub, Usman and Sardar both were armed with axe, but no axe injury, i.e. incised wound has been found on the body of any person of the complainant party. Mubarik has stated that Sardar caused injury to Ahmad Noor by blunt part of the axe, but this does not find place in the FIR. Ismile has also stated that Usman and Sardar had axe, but as observed earlier, no incised injury has been found on the body of any person from the complainant side. The High Court observed that Sardar allegedly caused injury by axe, but no incised injury has been found and, therefore; Sardar deserved the same benefit as his participation becomes doubtful and does not stand corroboration from the medical evidence. 36. In our view, this part of reasoning is entirely fallacious. It is to be seen from the evidence on record that Sardar is the main aggressor. It is established beyond reasonably doubt that he was the person who first accosted Yaqub, caught hold of him, beat him and threatened him. Thereafter within few minutes, he long with other accused came at the house of Mubarik, first assaulted Ismile and thereafter broke open the door of the house of Mubarik which was closed and assaulted deceased Ahmad Noor as well as Mubarik and Yusuf- Merely because the trial court has given benefit of doubt to Usman and Ramzu, it would not mean that Sardar who is the main person should also be given benefit of doubt despite the fact that all the witnesses have named him and stated that he was the aggressor and assaulter. It is true that incised injury is",512,RLC
C2250_c1,C2250,case,1,"respondent no.1 stated that a total number of 36 vacancies in the IPS were to be filled up on the basis of the Civil Services Examination, 1998 and out of total number of 36 vacancies, 21 vacancies were to be filled up by general candidates, 10 vacancies were to be filled up by OBC candidates and 5 vacancies were to be filled up by SC/ST candidates in accordance with the reservation provisions and the roster points and in May 1999, the vacancies were distributed category-wise in the following manner: 5. Respondent no.1 further stated in the additional affidavit that since as per the distribution made in the aforesaid table, the total number of vacancies for general candidates worked out to be 23 instead of 21 and total number of vacancies for OBC candidates worked out to be 8 instead of 10, 2 vacancies for general candidates had to be converted to 2 vacancies for OBC candidates. The respondent no.1 has also stated in the additional affidavit that as the relevant data for the last five years in respect of OBC candidates was not available with the respondent on 28.05.1999 when the entire exercise of allocation was completed and approved by the competent authority and the data for four years, i.e. from the Civil Services Examinations, 1994 to Civil Services Examinations, 1995, was available, the earlier advice of the Department of Personnel and Training in Annexure R-1 to the additional affidavit of the respondent no.1 was followed and two general vacancies from the first two States in the alphabetical order, one from the Andhra Pradesh Cadre and one from the Assam-Meghalaya Joint Cadre, were converted to OBC vacancies and the result was that respondent no.4 was allocated to the OBC vacancy of Andhra Pradesh Cadre. 6. The Tribunal in its order dated 09.01.2004 accepted this explanation of the respondent no.1 and rejected the argument of the appellant that the respondent no.1 had arbitrarily taken a lower ranking candidate in preference to high ranking general candidate while making the allocation to the Andhra Pradesh Cadre. Aggrieved, the appellant filed Writ Petition No.8072 of 2004 before the Andhra Pradesh High Court and contended that despite availability of data pertaining to OBC candidates for five years, the respondent no.1 did not consider the same while making the allocation. In the impugned order, however, the High Court held that this apprehension of the appellant was factually without any basis and did not find any fault with the order of the Tribunal. In the impugned order, the High Court also took the view that the appellant was required to implead all the candidates of his batch of IPS, as respondents in the O.A. as well as in the Writ Petition but had not done so and thus relief could not be granted to the appellant. The High Court further held in the impugned order that the allocation of the appellant to the Manipur-Tripura Joint Cadre was intimated to him by a letter dated 21.10.1999, but he filed the O.A. in 2001 and by the time the impugned order",512,RLC
C2266_c7,C2266,case,7,"not be restated in detail, the same reason. 16. As far as the issue no. 4 pertaining the NCR planning Board Act is concerned, the High Court has held that land could not be acquired without the permission of the Board. Opinion of the High Court on this aspect was questioned by the State of U.P. as well as Authority in its appeals. However, it was found that as a matter of fact, insofar as these cases are concerned consent of the Board had been obtained. Having regard to this position, while dismissing the appeals of the State/Authority, we have left the said question of law open, namely, whether permission of the deemed under the Act of 1985 is a pre-condition before acquisition of the land. Therefore, that aspect also needs no elaboration at our end in these appeals. 17. It becomes clear from the above that the High Court arrived at a conclusion that since invocation of S. 17(1) and 17(4) was uncalled for and unwarranted, the acquisition of the land of the appellants herein was illegal. Notwithstanding, the same, the High Court did not grant the relief of setting aside the entire acquisition and restoring the land to the appellants. After the aforesaid findings, the High Court observed that insofar as grant of particular relief to the land owners in land acquisition proceedings is concerned, it depends on several important factors. Thus, the issue of 'reliefs' has been discussed specifically and independently under the aforesaid caption. Here, the High Court has observed that the creation of third party rights, development undertaken over the land in dispute as well as the steps taken by the land owners after declaration made u/s. 6 of the Act would be the relevant consideration in determining the kind of relief that is to be granted to the land owners. Discussing the aforesaid aspects in the contexts of these proceedings, the High Court pointed out that in majority of cases third party rights had been created after issue of declaration u/s. 6 and after taking possession of the land, substantial developments including constructions had been undertaken. Thus, in those cases where substantial development had taken place and/or third party rights had been created, the High Court deemed it proper not to interfere with the acquisition. At the same time in order to balance the equities, it felt that grant of higher compensation and better share in the developed land to these land owners would meet the ends of justice. The exact relief given in this behalf shall be stated at the appropriate stage. 18. The High Court also found that in three villages no such third party rights had been created and no developments had taken place. So far as these villages are concerned, the High Court deemed it apposite to release the land in favour of the land owners of those villages. 19. The High Court also found that many writ petitions were filed challenging the acquisitions in respect of which notifications were issued much earlier, were totally stale and suffered from laches and delays.",512,RLC
C2268_c1,C2268,case,1,"Court and also directed Respondent No. 2 to take effective steps to produce the minor girl on the next date of hearing. (g) On 10.08.2011, i.e., on the next date of hearing, the Deputy Advocate General for the State filed a report in the matter and submitted that as per the report of the Police, Rajnandani was not detained by the Forest Officials. The High Court, after perusing the record and considering the report to be doubtful, granted further opportunity to the police to produce corpus of Rajnandani and also directed that in case Respondent No.2 fails to produce her on the next date of hearing, it would be compelled to direct the Central Bureau of Investigation (CBI) to take up the investigation into its hands. On 27.08.2011, Respondent No. 2 again submitted a progress report. The High Court, being not satisfied with the report, directed the Superintendent of Police, Betul to appear in person on the next date of hearing. On 12.09.2011, when the Superintendent of Police, Betul explained the circumstances in which the investigation was being conducted, the High Court observed that no proper investigation had been done by the police with the forest officials against whom the allegations had been made and gave one more chance to the Respondent No. 2 to produce Rajnandani before the Court. On 17.10.2011, Respondent No. 2 again filed a progress report before the Court in which it was stated that Rajnandani had tried to contact her father thrice from different mobile numbers but still the police officials were not able to trace her. (h) On 07.04.2012, Respondent No.2 filed an affidavit accepting the statements of forest officials and did not give any weightage to the statement of the eye-witness Kusum. It was also stated that the police accepted the version of the forest officials verbatim. (i) On 09.04.2012, the High Court, by accepting the progress report dated 07.04.2012, without taking note of the statement of the eye-witness Kusum, dismissed the writ petition. The High Court also held that the present case is not of illegal and forceful confinement warranting issue of a writ of habeas corpus but is a case of missing person. It was also held that there is no allegation in the petition to the effect that Rajnandani has been subjected to wrongful confinement either by the forest authorities or the police. (j) Being aggrieved, the appellant herein has filed this appeal by way of special leave. 4. Heard Mr. Prashant Bhushan, learned counsel for the appellant and Ms. Vibha Datta Makhija, learned senior counsel for the State of M.P. 5. The only point for consideration in this appeal is whether there is any lapse on the part of the State agency in carrying out the investigation and the facts and materials mandate for entrusting the investigation to the CBI? 6. Before going into the merits of the claim of both the sides, it is useful to refer the decision of the Constitution Bench of this Court in State of West Bengal and Ors. vs. Committee for Protection of Democratic Rights,",512,RLC
C2322_c6,C2322,case,6,"additional feed given, the nature of the terrain, the rain- fall and climatic conditions etc. That the feed available for the cattle is a very material and determining factor is apparent even from the rules, for a distinction is drawn between different areas of Madhya Pradesh depending on cotton seed being available for feeding the cattle. It is on the basis of the conjoint effects of these and other factors which obtain in the different areas, some pointing to a higher Reichert value and others neutralising it and after extensive survey conducted from samples collected and analysed during various seasons, that the country has been divided into zones under the rule in Appendix 'B' and the minimum Reichert value ascertained and prescribed for each. From the fact that certain areas included in some of the zones are hilly, it does not automatically follow that was the potent factor or the only factor which was taken into consideration for prescribing the standard for that region. Without appreciating the several factors which bear upon the Reichert value of the ghee produced in a locality and the value attributed to each of these several relevant factors, it would not be possible to pronounce upon the reasonable- ness or correctness of the classification of the areas and the prescription of different standards to each of them. In State v. Malik Ram (A.I.R. 1962 All. 156.134-159 S.C.-44) a Division Bench of the High Court held that because certain areas of Uttar Pradesh were hilly, the Reichert value prescribed for the hilly areas like those in Himachal Pradesh should be adopted and be given effect to notwithstanding there was no ambiguity in the rules as regards the area where the prescribed standards should be applicable. Except a principle which the Court deduced from the rules themselves there was no material before the Court that the minimum standard prescribed for Uttar Pradesh was defective in any respect. The approach adopted by the learned Judges in Malik Ram's case appears to us to be a reversal of the well-recognised principle that it is for those who challenge the Constitutionality of a statute or a statutory rule to allege and prove the grounds of invalidity and the adoption of the contrary rule that when a party makes such a challenge it is for those who seek to support it to sustain it by positive evidence of its reasonableness and legality. The Court evolved from a reading of the rules a principle that the standards vary with the elevation of the place, without having before it any materials for such a conclusion save what it considered was the rationale underlying the division into zones. As already explained, even in Himachal Pradesh the elevation of every place is not the same and there are areas which are higher than others and so the test adopted does not even satisfy logic. We do not consider that the Court was justified in practically legislating and laying down what the rules should be rather than give effect to the law by adherence to the rules as",512,RLC
C2367_c11,C2367,case,11,"a writ petition would not lie against an order made by the Chief Justice u/s. 11 of the Act and an appeal could be filed only u/art. 136 of the Constitution but proceeded to consider the issue raised by the writ petitioners on merits on the premise that appointments made on or before the judgment of the larger Bench had been saved. The Division Bench then observed that in terms of S. 15(2) of the Act, the Managing Director could, by relying upon the arbitration agreement, appoint another arbitrator because the original arbitrator had resigned. The Division Bench held that S. 15(2) of the Act is applicable not only to the cases of appointments under the statutory rules or rules framed under the Act but also the agreement between the parties for appointment of an arbitrator. While approving the decision of the High Court, this Court held: ""The term ""rules"" in S. 15(2) obviously referred to the provision for appointment contained in the arbitration agreement or any rules of any institution under which the disputes were referred to arbitration. There was no failure on the part of the party concerned as per the arbitration agreement, to fulfil his obligation in terms of S. 11 of the Act so as to attract the jurisdiction of the Chief Justice u/s. 11(6) of the Act for appointing a substitute arbitrator. Obviously, S. 11(6) of the Act has application only when a party or the person concerned had failed to act in terms of the arbitration agreement. When S. 15(2) says that a substitute arbitrator can be appointed according to the rules that were applicable for the appointment of the arbitrator originally, it is not confined to an appointment under any statutory rule or rule framed under the Act or under the scheme. It only means that the appointment of the substitute arbitrator must be done according to the original agreement or provision applicable to the appointment of the arbitrator at the initial stage. We are not in a position to agree with the contrary view taken by some of the High Courts. Since here, the power of the Managing Director of the respondent is saved by S. 15(2) of the Act and he has exercised that power on the terms of the arbitration agreement, we see no infirmity either in the decision of the learned Chief Justice or in that of the Division Bench....."" 18. The need for adherence to the terms of agreement which provide for resolution of differences or disputes by arbitration was highlighted in Datar Switchgears Ltd. v. Tata Finance Ltd. and another (2000) 8 SCC 151 2000 Inddlaw SC 28. In that case the appellant had filed an application u/s. 11 of the Act for appointment of an arbitrator by contending that despite clear 30 days notice, the first respondent failed to appoint an arbitrator in accordance with the terms of lease agreement. The Chief Justice of the High Court rejected the appellant's prayer by observing that respondent No.1 had appointed an arbitrator before filing of the application. In the appeal,",512,RLC
C238_c7,C238,case,7,"the scope and ambit of the jurisdiction of the High Court under that article. Did the High Court have jurisdiction in an application u/art. 227 to disturb the findings of fact reached by the District Court? It is well settled by the decision of this Court in Waryam Singh v. Amarnath 1954 Indlaw SC 180 that the ... power of superintendence conferred by Art. 227 is, as pointed out by Harries, C.J., in Dalmia Jain Airways v. Sukumar Mukherjee 1950 Indlaw CAL 142 to be exercised most sparingly and only in appropriate cases in order to keep the subordinate courts within the bounds of their authority and not for correcting mere errors. This statement of law was quoted with approval in the subsequent decision of this Court in Nagendra Nath Bose v. Commr. of Hills Division 1958 Indlaw SC 62 and it was pointed out by Sinha, J., as he then was, speaking on behalf of the court in that case: It is thus, clear that the powers of judicial interference u/art. 227 of the Constitution with orders of judicial or quasi-judicial nature, are not greater than the power u/art. 226 of the Constitution. U/art. 226 the power of interference may extend to quashing an impugned order on the ground of a mistake apparent on the face of the record. But u/art. 227 of the Constitution, the power of interference is limited to seeing that the tribunal functions within the limits of its authority."" 14. In the case of Birla Corpn. Ltd.. vs. Rajeshwar Mahato and Others, (2001) 10 SCC 2000 Indlaw SC 2971, the question of validity of termination of services of the respondent by the appellant-Corporation was referred to the Industrial Tribunal. On evidence, the Industrial Tribunal found that the duties of the respondent were mainly managerial or administrative. The Tribunal held that the respondent was not a workman and the reference was therefore not maintainable against the decision of the Tribunal. The Tribunal relying on S. 2(s)(iv) (as amended in West Bengal W.B.) held that as the respondent was drawing salary less than Rs.1600/- per month, he had to be regarded as a workman. The Corporation moved this Court against the order of the High Court. This Court while setting aside the decision of the High Court held as under :- ""4. It was not in dispute that at the time of the termination of services of Respondent 1, he was receiving Rs 1185 per month by way of salary. The Tribunal recorded the evidence as well as took into consideration documentary evidence which was produced by the parties. On the basis of the evidence which was adduced before it, the Tribunal observed that: ""The main duties of Shri Rajeshwar Mahato were both supervisory and administrative in nature. In the instant case, Shri Mahato's functions were mainly of a managerial nature. He had control as well as supervision over the work of the jute mill workers working under him."" 11. As we have also noticed hereinabove, the Tribunal had given a categorical finding to the effect that Respondent 1's",512,RLC
